{"businessModelEgress":false,"caseCatalogSha256":"b10c793a29114a7d92f048156b433056cfc8a81b0646dddf0ea1e954a3f381da","cases":[{"capabilityId":"employee.detail","caseId":"UAT-EMPLOYEE-001","httpStatus":200,"status":"success"},{"capabilityId":"employee.detail","caseId":"UAT-EMPLOYEE-002","httpStatus":200,"status":"success"},{"capabilityId":"employee.detail","caseId":"UAT-EMPLOYEE-003","httpStatus":403,"status":"forbidden"},{"capabilityId":null,"caseId":"UAT-EMPLOYEE-004","httpStatus":400,"status":"invalid_argument"}],"cleanup":{"ownedProcessesStopped":true,"rawLogsDeleted":true,"runtimeClosed":true},"gitHead":"e05e78c95e5a4b3893df88935e918976d07c4db5","modelProvider":"stub","requestCounts":{"answerGeneration":0,"embedding":0,"employee":3,"externalModelOutbound":0,"knowledgeSearch":0,"localKnowledgeModel":0,"otherBusinessEndpoints":0,"rerank":0,"transaction":0},"schemaVersion":1,"security":{"logLeakCount":0,"sensitivePersistence":false},"stage":"employee","status":"passed","suiteId":"single-agent-structured-query-uat-v1"}